### ISSUE TITLE
--region not working as expected

### ISSUE THREAD

**Issue by junaid18183** [uswitch/kiam#278]
I am deploying the kiam in gov cloud `us-gov-west-1`  have also set the --region=us-gov-west-1 and the env_var in the Daemonset `AWS_DEFAULT_REGION=us-gov-west-1`

but despite this fact the sts calls are going to commercial region. See below the tcpdump calls. 
```
[root@XXXX ~]# tcpdump -nn -i any port 53  | grep sts
tcpdump: verbose output suppressed, use -v or -vv for full protocol decode
listening on any, link-type LINUX_SLL (Linux cooked), capture size 262144 bytes
10:59:15.687082 IP 172.31.6.148.37147 > 172.31.0.2.53: 352+ AAAA? sts.us-gov-west-1.amazonaws.com. (49)
10:59:15.687175 IP 172.31.6.148.54443 > 172.31.0.2.53: 27946+ A? sts.us-gov-west-1.amazonaws.com. (49)
10:59:49.632413 IP 172.31.6.148.59348 > 172.31.0.2.53: 48134+ AAAA? sts.amazonaws.com. (35)
10:59:49.632503 IP 172.31.6.148.37469 > 172.31.0.2.53: 23997+ A? sts.amazonaws.com. (35)
```
Below are the server log - 

```
{"level":"error","msg":"error requesting credentials: InvalidClientTokenId: The security token included in the request is invalid\n\tstatus code: 403, request id: d75533dd-b83a-11e9-b025-678ced91ae23","pod.iam.role":"qa-james-kiam-testrole","time":"2019-08-06T11:10:47Z"}
{"level":"debug","msg":"evicted credentials future had error: InvalidClientTokenId: The security token included in the request is invalid\n\tstatus code: 403, request id: d75533dd-b83a-11e9-b025-678ced91ae23","pod.iam.role":"qa-james-kiam-testrole","time":"2019-08-06T11:10:47Z"}
{"generation.metadata":0,"level":"error","msg":"error warming credentials: InvalidClientTokenId: The security token included in the request is invalid\n\tstatus code: 403, request id: d75533dd-b83a-11e9-b025-678ced91ae23","pod.iam.role":"qa-james-kiam-testrole","pod.name":"demo-8c4f9ffb-cv5pv","pod.namespace":"default","pod.status.ip":"","pod.status.phase":"Pending","resource.version":"413787","time":"2019-08-06T11:10:47Z"}```

**Comment by junaid18183** [comment]
The first two calls in the tcpdump properly go to validate the provided region but later it goes back to `sts.amazonaws.com`

**Comment by junaid18183** [comment]
Closing this , We need to set the AWS_REGION environment variable as well along with the --region to work it properly

**Comment by p-kossa** [comment]
I've been seeing this issue in the same govcloud region as well. I'm using the --region flag and the AWS_DEFAULT_REGION env var for my cli container to test but I've seen no change unfortunately.

@junaid18183 May I ask what steps you took to resolve this? Thanks in advance.
